WHO	TYPE	SUBTYPE	REAL PROBLEM	PT	AUTHORS	TITLE	SOURCE	YEAR	ABSTRACT
JJ	ALL	SURVEY	YES	J	Gong, Yue-Jiao; Chen, Wei-Neng; Zhan, Zhi-Hui; Zhang, Jun; Li, Yun; Zhang, Qingfu; Li, Jing-Jing	Distributed evolutionary algorithms and their models: A survey of the state-of-the-art	APPLIED SOFT COMPUTING	2015	The increasing complexity of real-world optimization problems raises new challenges to evolutionary computation. Responding to these challenges, distributed evolutionary computation has received considerable attention over the past decade. This article provides a comprehensive survey of the state-of-the-art distributed evolutionary algorithms and models, which have been classified into two groups according to their task division mechanism. Population-distributed models are presented with master-slave, island, cellular, hierarchical, and pool architectures, which parallelize an evolution task at population, individual, or operation levels. Dimension-distributed models include coevolution and multi-agent models, which focus on dimension reduction. Insights into the models, such as synchronization, homogeneity, communication, topology, speedup, advantages and disadvantages are also presented and discussed. The study of these models helps guide future development of different and/or improved algorithms. Also highlighted are recent hotspots in this area, including the cloud and MapReduce-based implementations, GPU and CUDA-based implementations, distributed evolutionary multiobjective optimization, and real-world applications. Further, a number of future research directions have been discussed, with a conclusion that the development of distributed evolutionary computation will continue to flourish. (C) 2015 Elsevier B.V. All rights reserved.
JJ	ALL	SURVEY	YES	J	Ding Ke; Tan Ying	A review on general purpose computing on GPUs and its applications in computational intelligence	CAAI Transactions on Intelligent Systems	2015	The GPU enjoys the characteristics of high parallelism, low energy consumption and cheap price. Compared with the traditional CPU platform, it is especially suitable for tasks with high data parallelism. GPU computing has come into the mainstream of high performance computation (HPC) due to the emerging of development platforms like CUDA and OpenCL. The GPU's enormous computational power greatly promotes computational intelligence. A great success has been achieved in the fields such as deep learning and swarm intelligence optimization， and several breakthroughs have been seen in image, and speech recognition because of GPU. Though suffering some drawbacks, GPUs provide common people and small institutions with enormous computing power. This has changed the set-up of scientific computing and programming model because it could only be provided by expensive supercomputers. To help researchers in the field of computational intelligence better utilize GPUs, a detailed survey of GPGPU is given in this paper。First, the characteristics and advantages of GPUs against CPUs are presented. Then we briefly review the development of GPU hardware followed by a survey of the evolution of development tools for GPGPU; special attention is drawn to two major platforms, CUDA and OpenCL. We end this paper with our perspectives of the challenges and trends of GPGPU. We point out that embedding and cluster are two major trends for GPGPU and as both academia and industry continue to see increasing progress in artificial intelligence, the GPU will be more widely used in more domains.
ANTONIO	ALL	SURVEY	YES	S	Wang, Hongjian; Creput, Jean-Charles	Parallel and Distributed Implementation Models for Bio-inspired Optimization Algorithms	SWARM INTELLIGENCE BASED OPTIMIZATION (ICSIBO 2014)	2014	Bio-inspired optimization algorithms have natural parallelism but practical implementations in parallel and distributed computational systems are nontrivial. Gains from different parallelism philosophies and implementation strategies may vary widely. In this paper, we contribute with a new taxonomy for various parallel and distributed implementation models of metaheuristic optimization. This taxonomy is based on three factors that every parallel and distributed metaheuristic implementation needs to consider: control, data, and memory. According to our taxonomy, we categorize different parallel and distributed bio-inspired models as well as local search metaheuristic models. We also introduce a new designed GPU parallel model for the Kohonen's self-organizing map, as a representative example which belongs to a significant category in our taxonomy.
GUSTAVO	ALL	SURVEY	YES	J	Zhang Qingke; Yang Bo; Wang Lin; Zhu Fuxiang	Research on Parallel Modern Optimization Algorithms Using GPU	Computer Science	2012	In order to deal with the relatively high time-complexity of practical issue,parallel modern optimization based on GPU was presented in this paper.Firstly,CUDA parallel programming architecture and programming model were summarized at a macroscopic level.Then the parallel processes of five typical modern optimization algorithms(Simulated Annealing,Tabu Search,Genetic Algorithms,Particle Swarm Optimization and Artificial Neural Network) using CUDA programming model were provided.Experimental statistics measured in different environment indicate that the parallel method can obtain better performance on average than CPU.Finally the parallel optimization strategy was discussed and the outlook of future direction of parallel optimization algorithm was also pointed out.
GUSTAVO	ANN		no	J	Chedjou, J. C.; Kyamakya, K.	CNN-based ultrafast solver of stiff ODEs and PDEs for enabling realtime Computational Engineering	COMPEL-THE INTERNATIONAL JOURNAL FOR COMPUTATION AND MATHEMATICS IN ELECTRICAL AND ELECTRONIC ENGINEERING	2011	"Purpose - This paper seeks to develop, propose and validate, through a series of presentable examples, a comprehensive high-precision and ultra-fast computing concept for solving stiff ordinary differential equations (ODEs) and partial differential equations (PDEs) with cellular neural networks (CNN).Design/methodology/approach - The core of the concept developed in this paper is a straightforward scheme that we call ""nonlinear adaptive optimization (NAOP)"", which is used for a precise template calculation for solving any (stiff) nonlinear ODEs through CNN processors.Findings - One of the key contributions of this work (this is a real breakthrough) is to demonstrate the possibility of mapping/transforming different types of nonlinearities displayed by various classical and well-known oscillators (e.g. van der Pol-, Rayleigh-, Duffing-, Rossler-, Lorenz-, and Jerk-oscillators, just to name a few) unto first-order CNN elementary cells, and thereby enabling the easy derivation of corresponding CNN-templates. Furthermore, in case of PDEs solving, the same concept also allows a mapping unto first-order CNN cells while considering one or even more nonlinear terms of the Taylor's series expansion generally used in the transformation of a PDEs in a set of coupled nonlinear ODEs. Therefore, the concept of this paper does significantly contribute to the consolidation of CNN as a universal and ultra-fast solver of stiff differential equations (both ODEs and PDEs). This clearly enables a CNN-based, real-time, ultra-precise, and low-cost Computational Engineering. As proof of concept a well-known prototype of stiff equations (van der Pol) has been considered; the corresponding precise CNN-templates are derived to obtain precise solutions of this equation.Originality/value - This paper contributes to the enrichment of the literature as the relevant state-of-the-art does not provide a systematic and robust method to solve nonlinear ODEs and/or nonlinear PDEs using the CNN-paradigm. Further, the ""NAOP"" concept developed in this paper has been proven to perform accurate and robust calculations. This concept is not based on trial-and-error processes as it is the case for various classes of optimization methods/tools (e.g. genetic algorithm, particle swarm, neural networks, etc.). The ""NAOP"" concept developed in this frame does significantly contribute to the consolidation of CNN as a universal and ultra-fast solver of nonlinear differential equations (both ODES and PDEs). An implantation of the concept developed is possible even on embedded digital platforms (e.g. field-programmable gate array (FPGA), digital signal processing (DSP), graphics processing unit (GPU), etc.); this opens a broad range of applications. On-going works (as outlook) are using NAOP for deriving precise templates for a selected set of practically interesting PDE models such as Navier Stokes, Schrodinger, Maxwell, etc."
PEDRO	CFO		NO	J	Green, Robert C., II; Wang, Lingfeng; Alam, Mansoor; Formato, Richard A.	Central force optimization on a GPU: a case study in high performance metaheuristics	JOURNAL OF SUPERCOMPUTING	2012	Central Force Optimization (CFO) is a new and deterministic population based metaheuristic algorithm that has been demonstrated to be competitive with other metaheuristic algorithms such as Genetic Algorithms (GA), Particle Swarm Optimization (PSO), and Group Search Optimization (GSO). While CFO often shows superiority in terms of functional evaluations and solution quality, the algorithm is complex and typically requires increased computational time. In order to decrease the computational time required for convergence when using CFO, this study presents the first parallel implementation of CFO on a Graphics Processing Unit (GPU) using the NVIDIA Compute Unified Device Architecture (CUDA). Two versions of the CFO algorithm, Parameter-Free CFO (PF-CFO) and Pseudo-Random CFO (PR-CFO), are implemented using CUDA on a NVIDIA Quadro 1000M and examined using four test problems ranging from 10 to 50 dimensions. Discussion is made concerning the implementation of the CFO algorithms in terms of problem decomposition, memory access, scalability, and divergent code. Results demonstrate substantial speedups ranging from roughly 1 to 28 depending on problem size and complexity.
ANTONIO	DE	PSO	YES	S	Ugolotti, Roberto; Micconi, Giorgio; Aleotti, Jacopo; Cagnoni, Stefano	GPU-Based Point Cloud Recognition Using Evolutionary Algorithms	APPLICATIONS OF EVOLUTIONARY COMPUTATION	2014	In this paper, we describe a method for recognizing objects in the form of point clouds acquired with a laser scanner. This method is fully implemented on GPU and uses bio-inspired metaheuristics, namely PSO or DE, to evolve the rigid transformation that best aligns some references extracted from a dataset to the target point cloud. We compare the performance of our method with an established method based on Fast Point Feature Histograms (FPFH). The results prove that FPFH is more reliable under simple and controlled situations, but PSO and DE are more robust with respect to common problems as noise or occlusions.
MARIBEL	DE		YES	S	Ugolotti, Roberto; Mesejo, Pablo; Nashed, Youssef S. G.; Cagnoni, Stefano	GPU-Based Automatic Configuration of Differential Evolution: A Case Study	PROGRESS IN ARTIFICIAL INTELLIGENCE, EPIA 2013	2013	The performance of an evolutionary algorithm strongly depends on the choice of the parameters which regulate its behavior. In this paper, two evolutionary algorithms (Particle Swarm Optimization and Differential Evolution) are used to find the optimal configuration of parameters for Differential Evolution. We tested our approach on four benchmark functions, and the comparison with an exhaustive search demonstrated its effectiveness. Then, the same method was used to tune the parameters of Differential Evolution in solving a real-world problem: the automatic localization of the hippocampus in histological brain images. The results obtained consistently outperformed the ones achieved using manually-tuned parameters. Thanks to a GPU-based implementation, our tuner is up to 8 times faster than the corresponding sequential version.
MARIBEL	DE		YES	S	Cardenas-Montes, Miguel; Angel Vega-Rodriguez, Miguel; Sevilla, Ignacio; Ponce, Rafael; Jose Rodriguez-Vazquez, Juan; Sanchez Alvaro, Eusebio	Concurrent CPU-GPU Code Optimization: The Two-Point Angular Correlation Function as Case Study	ADVANCES IN ARTIFICIAL INTELLIGENCE, CAEPIA 2013	2013	Nowadays many computational systems are endowed of multi-cores in the main processor units, and one or more many-core cards. This makes possible the execution of codes on both computational resources concurrently. The challenge in this scenario is to balance correctly both execution paths. When the scenario is simple enough, by-hand optimization can be affordable, otherwise metaheuristic techniques are mandatory. In this work, Differential Evolution algorithm is implemented to optimize a concurrent CPU-GPU code calculating the Two-Point Angular Correlation Function applied to the study of Large-Scale Structure of the Universe. The Two-Point Angular Correlation Function is a computationally intensive function, requiring the calculation of three histograms with different execution times. Therefore, this forces to implement a parameter for describing the percentage of computation in CPU per histogram, and the counterpart in GPU; and to use metaheuristic techniques to fit the appropriate values for these three percentages. As a consequence of the optimization process described in this article, a significant reduction of the execution time is achieved. This proof of concept demonstrates that Evolutionary Algorithms are useful for fairly balancing computational paths in concurrent computing scenarios.
MARIBEL	DE		YES	S	Kroemer, Pavel; Platos, Jan; Snasel, Vaclav	A Brief Survey of Differential Evolution on Graphic Processing Units	PROCEEDINGS OF THE 2013 IEEE SYMPOSIUM ON DIFFERENTIAL EVOLUTION (SDE)	2013	Differential evolution is an efficient populational meta-heuristic optimization algorithm that has been applied to many difficult real world problems. Due to the relative simplicity of its operations and real encoded data structures, it is suitable for a parallel implementation on multicore systems and on Graphic Processing Units (GPUs) that nowadays reach peak performance of hundreds and thousands of giga FLOPS (floating-point operations per second). This study provides a brief survey of current state-of-the-art research on differential evolution in the GPU environment.
MARIBEL	DE		YES	S	de Oliveira, Fernando Bernardes; Davendra, Donald; Guimaraes, Frederico Gadelha	Multi-Objective Differential Evolution on the GPU with C-CUDA	SOFT COMPUTING MODELS IN INDUSTRIAL AND ENVIRONMENTAL APPLICATIONS	2013	In some applications, evolutionary algorithms may require high computational resources and high processing power, sometimes not producing a satisfactory solution after running for a considerable amount of time. One possible improvement is a parallel approach to reduce the response time. This work proposes to study a parallel multi-objective algorithm, the multi-objective version of Differential Evolution (DE). The generation of trial individuals can be done in parallel, greatly reducing the overall processing time of the algorithm. A novel approach to parallelize this algorithm is the implementation on the Graphic Processing Units (GPU). These units present high degree of parallelism and they were initially developed for image rendering. However, NVIDIA has released a framework, named CUDA, which allows developers to use GPU for general-purpose computing (GPGPU). This work studies the implementation of Multi-Objective DE (MODE) on the GPU with C-CUDA, evaluating the gain in processing time against the sequential version. Benchmark functions are used to validate the implementation and to confirm the efficiency of MODE on the GPU. The results show that the approach achieves an expressive speed up and a highly efficient processing power.
PEDRO	DE		NO	J	Fabris, Fabio; Krohling, Renato A.	A co-evolutionary differential evolution algorithm for solving min-max optimization problems implemented on GPU using C-CUDA	EXPERT SYSTEMS WITH APPLICATIONS	2012	Several areas of knowledge are being benefited with the reduction of the computing time by using the technology of graphics processing units (GPU) and the compute unified device architecture (CUDA) platform. In case of evolutionary algorithms, which are inherently parallel, this technology may be advantageous for running experiments demanding high computing time. In this paper, we provide an implementation of a co-evolutionary differential evolution (DE) algorithm in C-CUDA for solving min-max problems. The algorithm was tested on a suite of well-known benchmark optimization problems and the computing time has been compared with the same algorithm implemented in C. Results demonstrate that the computing time can significantly be reduced and scalability is improved using C-CUDA. As far as we know, this is the first implementation of a co-evolutionary DE algorithm in C-CUDA. (C) 2011 Elsevier Ltd. All rights reserved.
PEDRO	DE		NO	B	Davendra, Donald; Gaura, Jan; Bialic-Davendra, Magdalena; Senkerik, Roman	CUDA BASED ENHANCED DIFFERENTIAL EVOLUTION: A COMPUTATIONAL ANALYSIS	PROCEEDINGS 26TH EUROPEAN CONFERENCE ON MODELLING AND SIMULATION ECMS 2012	2012	General purpose graphic programming unit (GPGPU) programming is a novel approach for solving parallel variable independent problems. The graphic processor core (GPU) gives the possibility to use multiple blocks, each of which contains hundreds of threads. Each of these threads can be visualized as a core onto itself, and tasks can be simultaneously sent to all the threads for parallel evaluations. This research explores the advantages of applying a evolutionary algorithm (EA) on the GPU in terms of computational speedups. Enhanced Differential Evolution (EDE) is applied to the generic permutative flowshop scheduling (PFSS) problem both using the central processing unit (CPU) and the GPU, and the results in terms of execution time is compared.
PEDRO	DE		NO	S	Arabas, Jaroslaw; Maitre, Ogier; Collet, Pierre	PARADE: A Massively Parallel Differential Evolution Template for EASEA	SWARM AND EVOLUTIONARY COMPUTATION	2012	This paper presents an efficient PARAllelization of Differential Evolution on GPU hardware written as an EASEA (EAsy Specification of Evolutionary Algorithms) template for easy reproducibility and re-use. We provide results of experiments to illustrate the relationship between population size and efficiency of the parallel version based on GPU related to the sequential version on the CPU. We also discuss how the population size influences the number of generations to obtain a certain level of result quality.
PEDRO	DE		YES	S	Qin, A. K.; Raimondo, Federico; Forbes, Florence; Ong, Yew Soon	An Improved CUDA-Based Implementation of Differential Evolution on GPU	PROCEEDINGS OF THE FOURTEENTH INTERNATIONAL CONFERENCE ON GENETIC AND EVOLUTIONARY COMPUTATION CONFERENCE	2012	Modern GPUs enable widely affordable personal computers to carry out massively parallel computation tasks. NVIDIA's CUDA technology provides a wieldy parallel computing platform. Many state-of-the-art algorithms arising from different fields have been redesigned based on CUDA to achieve computational speedup. Differential evolution (DE), as a very promising evolutionary algorithm, is highly suitable for parallelization owing to its data-parallel algorithmic structure. However, most existing CUDA-based DE implementations suffer from excessive low-throughput memory access and less efficient device utilization. This work presents an improved CUDA-based DE to optimize memory and device utilization: several logically-related kernels are combined into one composite kernel to reduce global memory access; kernel execution configuration parameters are automatically determined to maximize device occupancy; streams are employed to enable concurrent kernel execution to maximize device utilization. Experimental results on several numerical problems demonstrate superior computational time efficiency of the proposed method over two recent CUDA-based DE and the sequential DE across varying problem dimensions and algorithmic population sizes.
PEDRO	DE		NO	S	Zhou, Xinyu; Wu, Zhijian; Wang, Hui	Elite Opposition-based Differential Evolution for Solving Large-scale Optimization Problems and Its Implementation on GPU	2012 13TH INTERNATIONAL CONFERENCE ON PARALLEL AND DISTRIBUTED COMPUTING, APPLICATIONS, AND TECHNOLOGIES (PDCAT 2012)	2012	Recently, the interests of solving large-scale optimization problems have increased in the field of evolutionary algorithms. This paper presents a novel differential evolution, namely EOBDE, to solve these kinds of problems by using elite opposition-based learning strategy. In the proposed algorithm, the opposite solutions of some selected elite individuals from the current population are generated at a certain probability for generation jumping. Then a corresponding opposite population is constructed to compete with the current population for providing more chances of finding out the global optimum. This approach is helpful to obtain a tradeoff between exploration and exploitation ability of DE. As another contribution, a parallel version of the proposed algorithm is implemented on Graphics Processing Units (GPU) based on CUDA platform for accelerating computing speed. The experiments are carried out on a set of representative problems with D=500 and 1000. The results of EOBDE are compared with other four state-of-the-art evolutionary algorithms in order to investigate the performance, which show that our proposed algorithm outperform the compared algorithms in terms of solution accuracy. Also the parallel version based on GPU shows promising performance in terms of the computational time.
ANTONIO	EDA	UMDA	YES	S	de Souza, Murilo Zangari; Ramirez Pozo, Aurora Trinidad	Parallel MOEA/D-ACO on GPU	ADVANCES IN ARTIFICIAL INTELLIGENCE (IBERAMIA 2014)	2014	This paper describes the idea of MOEA/D-ACO (Multiobjective Evolutionary Algorithm based on Decomposition and Ant Colony Optimization) and proposes a Graphics Processing Unit (GPU) implementation of MOEA/D-ACO using NVIDIA CUDA (Compute Unified Device Architecture) in order to improve the execution time. ACO is well-suited to GPU implementation, and both the solution construction and pheromone update phase are implemented using a data parallel approach. The parallel implementation is applied on the Multiobjective 0-1 Knapsack Problem and the Multiobjective Traveling Salesman Problem and reports speedups up to 19x and 11x respectively from the sequential counterpart with similar quality results. Moreover, the results show that the size of test instances, the number of objectives and the number of subproblems directly affect the speedup.
GUSTAVO	ES		no	J	Zhu, Weihang	Nonlinear optimization with a massively parallel Evolution Strategy-Pattern Search algorithm on graphics hardware	APPLIED SOFT COMPUTING	2011	This paper presents a massively parallel Evolution Strategy-Pattern Search Optimization (ES-PS) algorithm with graphics hardware acceleration on bound constrained nonlinear continuous optimization problems. The algorithm was specifically designed for a graphic processing unit (GPU) hardware platform featuring 'Single Instruction Multiple Thread' (SIMT). Evolution Strategy is a population-based evolutionary algorithm for solving complex optimization problems. GPU computing is an emerging desktop parallel computing platform. The hybrid ES-PS optimization method was implemented in the GPU environment and compared to a similar implementation on Central Processing Units (CPU). Computational results indicated that GPU-accelerated SIMT-ES-PS method was orders of magnitude faster than the corresponding CPU implementation. The main contribution of this paper was the parallelization analysis and performance analysis of the hybrid ES-PS with GPU acceleration. The computational results demonstrated a promising direction for high speed optimization with desktop parallel computing on a personal computer (PC). (C) 2010 Elsevier B.V. All rights reserved.
PABLO	ES		NO	B	Zhu, Weihang	A Study of Parallel Evolution Strategy - Pattern Search on a GPU Computing Platform	WORLD SUMMIT ON GENETIC AND EVOLUTIONARY COMPUTATION (GEC 09)	2009	This paper presents a massively parallel Evolution Strategy Pattern Search Optimization (ES-PS) algorithm with graphics hardware acceleration on bound constrained nonlinear continuous optimization functions. The algorithm is specifically designed for a graphic processing unit (CPU) hardware platform featuring 'Single Instruction Multiple Thread' (SIMT). CPU computing is an emerging desktop parallel computing platform. The hybrid ES-PS optimization method is implemented in the GPU environment and compared to a similar implementation on CPU hardware. Computational results indicate that CPU-accelerated SIMT-ES-PS method is orders of magnitude faster than the corresponding CPU implementation. The main contribution of this paper is the parallelization analysis and performance analysis of the hybrid ES-PS with CPU acceleration.
