WHO	TYPE	SUBTYPE	REAL PROBLEM	PT	AUTHORS	TITLE	SOURCE	YEAR	ABSTRACT
GUSTAVO	GA		yes	S	Fontanarosa, Joel B; Dai, Yang	An evolutionary optimization strategy using graphics processing units to efficiently investigate gene-gene interactions in genetic association studies.	Conference proceedings : ... Annual International Conference of the IEEE Engineering in Medicine and Biology Society. IEEE Engineering in Medicine and Biology Society. Annual Conference	2011	The analysis of gene-gene interactions related to common complex human diseases is complicated by the increasing scale of genetic association analysis. Concurrent with the advances in genetic technology that led to these large data sets, improvements have been made in parallel computing with graphics processing units (GPUs). The data-intensive nature of genetic association analysis makes this problem particularly suitable for improved computation with the powerful computing resources available in GPUs. In this study, we present a GPU-accelerated discrete optimization strategy to improve the computational efficiency of multi-locus association analysis. We implemented an adaptive evolutionary algorithm that takes advantage of linkage disequilibrium to reduce the need for exhaustive search for combinations of genetic markers. The proposed GPU algorithm was shown to have improved efficiency and equivalent power relative to the CPU version.
GUSTAVO	GA		no	S	Prata, Paula; Fazendeiro, Paulo; Sequeira, Pedro	Towards Cost-Effective Bio-inspired Optimization: A Prospective Study on the GPU Architecture	SWARM, EVOLUTIONARY, AND MEMETIC COMPUTING, PT II	2011	This paper studies the impact of varying the population's size and the problem's dimensionality in a parallel implementation, for an NVIDIA GPU, of a canonical GA. The results show that there is an effective gain in the data parallel model provided by modern GPU's and enhanced by high level languages such as OpenCL. In the reported experiments it was possible to obtain a speedup higher than 140 thousand times for a population's size of 262 144 individuals.
GUSTAVO	GA		no	J	Rouhipour, Marjan; Bentley, Peter J.; Shayani, Hooman	Fast bio-inspired computation using a GPU-based systemic computer	PARALLEL COMPUTING	2010	Biology is inherently parallel. Models of biological systems and bio-inspired algorithms also share this parallelism, although most are simulated on serial computers. Previous work created the systemic computer - a new model of computation designed to exploit many natural properties observed in biological systems, including parallelism. The approach has been proven through two existing implementations and many biological models and visualizations. However to date the systemic computer implementations have all been sequential simulations that do not exploit the true potential of the model. In this paper the first ever parallel implementation of systemic computation is introduced. The CPU Systemic Computation Architecture is the first implementation that enables parallel systemic computation by exploiting the multiple cores available in graphics processors. Comparisons with the serial implementation when running two programs at different scales show that as the number of systems increases, the parallel architecture is several hundred times faster than the existing implementations, making it feasible to investigate systemic models of more complex biological systems. (C) 2010 Elsevier B.V. All rights reserved.
GUSTAVO	GA		no	J	Hu, Ting; Harding, Simon; Banzhaf, Wolfgang	Variable population size and evolution acceleration: a case study with a parallel evolutionary algorithm	GENETIC PROGRAMMING AND EVOLVABLE MACHINES	2010	With current developments of parallel and distributed computing, evolutionary algorithms have benefited considerably from parallelization techniques. Besides improved computation efficiency, parallelization may bring about innovation to many aspects of evolutionary algorithms. In this article, we focus on the effect of variable population size on accelerating evolution in the context of a parallel evolutionary algorithm. In nature it is observed that dramatic variations of population size have considerable impact on evolution. Interestingly, the property of variable population size here arises implicitly and naturally from the algorithm rather than through intentional design. To investigate the effect of variable population size in such a parallel algorithm, evolution dynamics, including fitness progression and population diversity variation, are analyzed. Further, this parallel algorithm is compared to a conventional fixed-population-size genetic algorithm. We observe that the dramatic changes in population size allow evolution to accelerate.
GUSTAVO	GA		yes	S	Pospichal, Petr; Schwarz, Josef; Jaros, Jiri	PARALLEL GENETIC ALGORITHM SOLVING 0/1 KNAPSACK PROBLEM RUNNING ON THE GPU	16TH INTERNATIONAL CONFERENCE ON SOFT COMPUTING MENDEL 2010	2010	In this work, we show that consumer-level $100 CPU can be used to significantly speed-up optimization of 0/1 Knapsack problem. We identify strong and weak points of CPU architecture and propose our parallel genetic algorithm model implemented in CUDA running entirely on the CPU. We show that CPU must be utilized for sufficiently long time in order to obtain reasonable program speedup. Then we compare results quality and speed of our model with single-threaded CPU code implemented using Galib. Peak speedup of CPU GA execution performance is 1340x resp. 134x for 4-bit resp. 40-bit problem instances while maintaining reasonable results quality.
GUSTAVO	GA		yes	S	Ebner, Marc	Evolving Object Detectors with a GPU Accelerated Vision System	EVOLVABLE SYSTEMS: FROM BIOLOGY TO HARDWARE	2010	Using CPU processing, it is now possible to develop an evolutionary vision system working at interactive frame rates. Our system uses motion as an important cue to evolve detectors which are able to detect an object when this cue is not available. Object detectors consist of a series of high level operators which are applied to the input image. A matrix of low level point operators are used to recombine the output of the high level operators. With this contribution, we investigate, which image processing operators are most useful for object detection. It was found that the set of image processing operators could be considerably reduced without reducing recognition performance. Reducing the set of operators lead to an increase in speedup compared to a standard CPU implementation.
GUSTAVO	GA		yes	S	Rouhipour, Marjan; Bentley, Peter J.; Shayani, Hooman	Systemic Computation Using Graphics Processors	EVOLVABLE SYSTEMS: FROM BIOLOGY TO HARDWARE	2010	Previous work created the systemic computer a model of computation designed to exploit many natural properties observed in biological systems, including parallelism. The approach has been proven through two existing implementations and many biological models and visualizations. However to date the systemic computer implementations have all been sequential simulations that do not exploit the true potential of the model. In this paper the first parallel implementation of systemic computation is introduced. The GPU Systemic Computation Architecture is the first implementation that enables parallel systemic computation by exploiting multiple cores available in graphics processors. Comparisons with the serial implementation when running a genetic algorithm at different scales show that as the number of systems increases, the parallel architecture is several hundred times faster than the existing implementations, making it feasible to investigate systemic models of more complex biological systems.
PABLO	GA		YES	J	Park, In Kyu; 안일준	Design of Omok AI using Genetic Algorithm and Game Trees and Their Parallel Processing on the GPU	Journal of KIISE : Computer Systems and Theory	2010	This paper proposes an efficient method for design and implementation of the artificial intelligence (AI) of ‘omok’ game on the GPU. The proposed AI is designed on a cooperative structure using min-max game tree and genetic algorithm. Since the evaluation function needs intensive computation but is independently performed on a lot of candidates in the solution space, it is computed on the GPU in a massive parallel way. The implementation on NVIDIA CUDA and the experimental results show that it outperforms significantly over the CPU, in which parallel game tree and genetic algorithm on the GPU runs more than 400 times and 300 times faster than on the CPU. In the proposed cooperative AI, selective search using genetic algorithm is performed subsequently after the full search using game tree to search the solution space more efficiently as well as to avoid the thread overflow. Experimental results show that the proposed algorithm enhances the AI significantly and makes it run within the time limit given by the game's rule.
PABLO	GA		NO	S	Vidal, Pablo; Alba, Enrique	Cellular Genetic Algorithm on Graphic Processing Units	NICSO 2010: NATURE INSPIRED COOPERATIVE STRATEGIES FOR OPTIMIZATION	2010	The availability of low cost powerful parallel graphic cards has estimulated a trend to implement diverse algorithms on Graphic Processing Units (GPUs). In this paper we describe the design of a parallel Cellular Genetic Algorithm (cGA) on a GPU and then evaluate its performance. Beyond the existing works on master-slave for fitness evaluation, we here implement a cGA exploiting data and instructions parallelism at the population level. Using the CUDA language on a GTX-285 CPU hardware, we show how a cGA can profit from it to create an algorithm of improved physical efficiency and numerical efficacy with respect to a CPU implementation. Our approach stores individuals and their fitness values in the global memory of the CPU. Both, fitness evaluation and genetic operators are implemented entirely on GPU (i.e. no CPU is used). The presented approach allows us benefit from the numerical advantages of cGAs and the efficiency of a low-cost hut powerful platform.
PABLO	GA		NO	S	Sharma, Deepak; Collet, Pierre	GPGPU-Compatible Archive Based Stochastic Ranking Evolutionary Algorithm (G-ASREA) for Multi-Objective Optimization	PARALLEL PROBLEM SOLVING FROM NATURE-PPSN XI, PT II	2010	In this paper, a GPGPU (general purpose graphics processing unit) compatible Archived based Stochastic Ranking Evolutionary Algorithm (G-ASREA) is proposed, that ranks the population with respect to an archive of non-dominated solutions. It reduces the complexity of the deterministic ranking operator from O(mn(2)) to O(man)(star) and further speeds up ranking on GPU.Experiments compare G-ASREA with a CPU version of ASREA and NSGA-II on ZDT test functions for a wide range of population sizes. The results confirm the gain in ranking complexity by showing that on 10K individuals, G-ASREA ranking is approximate to x5000 faster than NSGA-II and approximate to x15 faster than ASREA.
PABLO	GA		YES	S	Steflen, Peter; Giegerich, Robert; Giraud, Mathieu	GPU Parallelization of Algebraic Dynamic Programming	PARALLEL PROCESSING AND APPLIED MATHEMATICS, PART II	2010	Algebraic Dynamic Programming (ADP) is a framework to encode a broad range of optimization problems, including common bioinformatics problems like RNA folding or pairwise sequence alignment The ADP complier translates such ADP programs into C As all the ADP problems have similar data dependencies in the dynamic programming tables a genetic parallelization is possible We updated the compiler to include a parallel backend launching a large number of independent threads Depending on the application, we report speedups ranging from 6.1 x to 25.8 x on a Nvidia GTX 280 through the CUDA libraries
PABLO	GA		YES	J	Munawar, Asim; Wahib, Mohamed; Munetomo, Masaharu; Akama, Kiyoshi	Hybrid of genetic algorithm and local search to solve MAX-SAT problem using nVidia CUDA framework	GENETIC PROGRAMMING AND EVOLVABLE MACHINES	2009	General Purpose computing over Graphical Processing Units (GPGPUs) is a huge shift of paradigm in parallel computing that promises a dramatic increase in performance. But GPGPUs also bring an unprecedented level of complexity in algorithmic design and software development. In this paper we describe the challenges and design choices involved in parallelizing a hybrid of Genetic Algorithm (GA) and Local Search (LS) to solve MAXimum SATisfiability (MAX-SAT) problem on a state-of-the-art nVidia Tesla GPU using nVidia Compute Unified Device Architecture (CUDA). MAX-SAT is a problem of practical importance and is often solved by employing metaheuristics based search methods like GAs and hybrid of GA with LS. Almost all the parallel GAs (pGAs) designed in the last two decades were designed for either clusters or MPPs. Unfortunately, very little research is done on the implementation of such algorithms over commodity graphics hardware. GAs in their simple form are not suitable for implementation over the Single Instruction Multiple Thread (SIMT) architecture of a GPU, and the same is the case with conventional LS algorithms. In this paper we explore different genetic operators that can be used for an efficient implementation of GAs over nVidia GPUs. We also design and introduce new techniques/operators for an efficient implementation of GAs and LS over such architectures. We use nVidia Tesla C1060 to perform several numerical tests and performance measurements and show that in the best case we obtain a speedup of 25x. We also discuss the effects of different optimization techniques on the overall execution time.
PABLO	GA		YES	J	Robilliard, Denis; Marion-Poty, Virginie; Fonlupt, Cyril	Genetic programming on graphics processing units	GENETIC PROGRAMMING AND EVOLVABLE MACHINES	2009	The availability of low cost powerful parallel graphics cards has stimulated the port of Genetic Programming (GP) on Graphics Processing Units (GPUs). Our work focuses on the possibilities offered by Nvidia G80 GPUs when programmed in the CUDA language. In a first work we have showed that this setup allows to develop fine grain parallelization schemes to evaluate several GP programs in parallel, while obtaining speedups for usual training sets and program sizes. Here we present another parallelization scheme and optimizations about program representation and use of GPU fast memory. This increases the computation speed about three times faster, up to 4 billion GP operations per second. The code has been developed within the well known ECJ library and is open source.
PABLO	GA	ML	YES	J	Fuchs, Raphael; Waser, Juergen; Groeller, Meister Eduard	Visual Human plus Machine Learning	IEEE TRANSACTIONS ON VISUALIZATION AND COMPUTER GRAPHICS	2009	In this paper we describe a novel method to integrate interactive visual analysis and machine learning to support the insight generation of the user. The suggested approach combines the vast search and processing power of the computer with the superior reasoning and pattern recognition capabilities of the human user. An evolutionary search algorithm has been adapted to assist in the fuzzy logic formalization of hypotheses that aim at explaining features inside multivariate, volumetric data. Up to now, users solely rely on their knowledge and expertise when looking for explanatory theories. However, it often remains unclear whether the selected attribute ranges represent the real explanation for the feature of interest. Other selections hidden in the large number of data variables could potentially lead to similar features. Moreover, as simulation complexity grows, users are confronted with huge multidimensional data sets making it almost impossible to find meaningful hypotheses at all. We propose an interactive cycle of knowledge-based analysis and automatic hypothesis generation. Starting from initial hypotheses, created with linking and brushing, the user steers a heuristic search algorithm to look for alternative or related hypotheses. The results are analyzed in information visualization views that are linked to the volume rendering. Individual properties as well as global aggregates are visually presented to provide insight into the most relevant aspects of the generated hypotheses. This novel approach becomes computationally feasible due to a GPU implementation of the time-critical parts in the algorithm. A thorough evaluation of search times and noise sensitivity as well as a case study on data from the automotive domain substantiate the usefulness of the suggested approach.
PABLO	GA		NO	B	Zaloudek, Ludek; Sekanina, Lukas; Simek, Vaclav	GPU Accelerators for Evolvable Cellular Automata	2009 COMPUTATION WORLD: FUTURE COMPUTING, SERVICE COMPUTATION, COGNITIVE, ADAPTIVE, CONTENT, PATTERNS	2009	In order to design cellular automata rules by means of evolutionary algorithms, high computational demands need to be met. This problem may be partially solved by parallelization. Since parallel supercomputers and server clusters are expensive and often overburdened, this paper proposes the evolution of cellular automata rules on small and inexpensive graphic processing units. The main objective of this paper is not to evolve any actual cellular automata but to demonstrate that evolution of cellular automata rules can be accelerated significantly using graphics processing units. Several methods of speeding-up the evolution of cellular automata rules are proposed, evaluated and compared, some with very good results.
PABLO	GA		NO	S	Maitre, Ogier; Lachiche, Nicolas; Clauss, Philippe; Baumes, Laurent; Corma, Avelino; Collet, Pierre	Efficient Parallel Implementation of Evolutionary Algorithms on GPGPU Cards	EURO-PAR 2009: PARALLEL PROCESSING, PROCEEDINGS	2009	"A parallel solution to the implementation of evolutionary algorithms is proposed; where the most; costly part of the whole evolutionary algorithm computations (the population evaluation), is deported to a GPGPU card. Experiments are presented for two benchmark examples on two models of GPGPU cards: first a ""toy"" problem is used to illustrate some noticable behaviour characteristics before a real problem is tested out. Results show a speed-up of up to 100 times compared to an execution on a standard micro-processor. To our knowledge; this solution is the first showing such an efficiency with GPGPU cards. Finally, the EASEA language and its compiler are also extended to allow users to easily specify and generate efficient parallel implementations of evolutionay algorithms using GPGPU cards."
PABLO	GA		NO	S	Wong, Man Leung; Wong, Tien Tsin	Implementation of Parallel Genetic Algorithms on Graphics Processing Units	INTELLIGENT AND EVOLUTIONARY SYSTEMS	2009	In this paper, we propose to parallelize a Hybrid Genetic Algorithm (HGA) on Graphics Processing Units (GPUs) which are available and installed on ubiquitous personal computers. HGA extends the classical genetic algorithm by incorporating the Cauchy mutation operator from evolutionary programming. In our parallel HGA, all steps except the random number generation procedure are performed in GPU and thus our parallel HGA can be executed effectively and efficiently. We suggest and develop the novel pseudo-deterministic selection method which is comparable to the traditional global selection approach with significant execution time performance advantages. We perform experiments to compare our parallel HGA with our previous parallel FEP (Fast Evolutionary programming) and demonstrate that the former is much more effective and efficient than the latter. The parallel and sequential implementations of HGA are compared in a number of experiments, it is observed that the former outperforms the latter significantly. The effectiveness and efficiency of the pseudo-deterministic selection method is also studied.
PABLO	GA		YES	J	Nie, Dong-Hu; Han, Kyu-Phil; Lee, Heng-Suk	GPU-based Stereo Matching Algorithm with the Strategy of Population-based Incremental Learning	Journal of Information Processing Systems	2009	To solve the general problems surrounding the application of genetic algorithms in stereo matching, two measures are proposed. Firstly, the strategy of simplified population-based incremental learning (PBIL) is adopted to reduce the problems with memory consumption and search inefficiency， and a scheme for controlling the distance of neighbors for disparity smoothness is inserted to obtain a wide-area consistency of disparities. In addition, an alternative version of the proposed algorithm, without the use of a probability vector, is also presented for simpler set-ups. Secondly, programmable graphics-hardware (GPU) consists of multiple multi-processors and has a powerful parallelism which can perform operations in parallel at low cost. Therefore, in order to decrease the running time further, a model of the proposed algorithm, which can be run on programmable graphics-hardware (GPU), is presented for the first time. The algorithms are implemented on the CPU as well as on the GPU and are evaluated by experiments. The experimental results show that the proposed algorithm offers better performance than traditional BMA methods with a deliberate relaxation and its modified version in terms of both running speed and stability. The comparison of computation times for the algorithm both on the GPU and the CPU shows that the former has more speed-up than the latter, the bigger the image size is.
PABLO	GA		NO	J	LI Jianming; CHI Zhongxian; WAN Danling	Parallel genetic algorithm based on fine-grained model with GPU-accelerated	Control and Decision	2008	An algorithm based on GPU(graphics processing unit) acceleration fine-grained parallel genetic algorithm(PGA) is proposed to improve the performance of genetic algorithm for application to large-scale problems and multivariable solutions. The process of parallel genetic algorithms is converted into that of texture-rendering based on GPU, which maks PGA greatly accelerated in it. The experimental results show that the algorithm inhibits the phenomenon of premature efficiently, increases the particle population in the PGA, speeds up its running and provides ordinary user with a feasible PGA solution.
PABLO	GA		YES	B	Franke, Tobias; Jung, Yvonne	Real-time mixed reality with GPU techniques	GRAPP 2008: PROCEEDINGS OF THE THIRD INTERNATIONAL CONFERENCE ON COMPUTER GRAPHICS THEORY AND APPLICATIONS	2008	In this paper, we propose a combination of modem GPU-based methods that are able to generate high-quality, interactive real-time rendering for augmented and mixed reality applications. We also present a new approach to estimate surface reflection functions and materials from images using genetic algorithms.
PABLO	GA		NO	B	Li, Jian-Ming; Wang, Xiao-Jing; He, Rong-Sheng; Chi, Zhong-Xian	An efficient fine-grained parallel genetic algorithm based on GPU-accelerated	2007 IFIP INTERNATIONAL CONFERENCE ON NETWORK AND PARALLEL COMPUTING WORKSHOPS, PROCEEDINGS	2007	Fine-grained parallel genetic algorithm (FGPGA), though a popular and robust strategy for solving complicated optimization problems, is sometimes inconvenient to use as its population size is restricted by heavy data communication and the parallel computers are relatively difficult to use, manage, maintain and may not be accessible to most researchers. In this paper, we propose a FGPGA method based on GPU-acceleration, which maps parallel GA algorithm to texture-rendering on consumer-level graphics cards. The analytical results demonstrate that the proposed method increases the population size, speeds up its execution and provides ordinary users with a feasible FGPGA solution.
PABLO	GA		NO	B	Wong, Man-Leung; Wong, Tien-Tsin	Parallel hybrid genetic algorithms on consumer-level graphics hardware	2006 IEEE CONGRESS ON EVOLUTIONARY COMPUTATION, VOLS 1-6	2006	In this paper, we report a parallel Hybrid Genetic Algorithm (HGA) on consumer-level graphics cards. HGA extends the classical genetic algorithm by incorporating the Cauchy mutation operator from evolutionary programming. In our parallel HGA, all steps except the random number generation procedure are performed in Graphics Processing Unit (GPU) and thus our parallel HGA can be executed effectively and efficiently. We propose the pseudo-deterministic selection method which is comparable to the traditional global selection approach with significant execution time performance advantages. We perform experiments to compare our parallel HGA with our previous parallel FEP (Fast Evolutionary programming) and demonstrate that the former is much more effective and efficient than the latter. The parallel and sequential implementations of HGA are compared in a number of experiments, it is observed that the former outperforms the latter significantly. The effectiveness and efficiency of the pseudodeterministic selection method is also studied.
PABLO	GA		YES	B	Kaul, Karsten; Bohn, Christian-A.	A Genetic Texture Packing Algorithm on a Graphical Processing Unit	9TH INTERNATIONAL CONFERENCE ON COMPUTER GRAPHICS AND ARTIFICIAL INTELLIGENCE	2006	"Interactively modeled virtual scenes usually contain hundreds of single separate textures. A common task to prepare these scenes for real-time rendering is to compile the set of many textures into one large texture which is better suited to be handled by modern graphics hardware.We present an approach for accomplishing the above task automatically. First, a patchwork of near-optimal compactness is calculated through a genetic algorithm (GA), second - since ""GA are slow"" - we implement the genetic algorithm on a CPU and show that it easily outperforms a standard CPU implementation."
